user_message,discrimination_type
I was denied a promotion because of my gender,gender
I was passed over for a project due to my age,age
I was discriminated because of my age,age
My supervisor made inappropriate comments about my disability,disability
I feel I am treated unfairly because of my religion,religion
I am being harassed at work based on my sexual orientation,sexual_orientation
I was not considered for a position due to my race,race
My colleagues make jokes about my pregnancy,pregnancy
I am excluded from team activities because of my nationality,nationality
